category,question_title,question_content,question_date,question_url
Huyết học,sàng lọc Thalassemia,"Bsĩ ơi cho em hỏi. Hôm trước e có xét nghiệm máu tại viện mình, kết quả là : Tổng phân tích tế bào máu có thể tích trung bình hồng cầu (MCV là 76,2) nhỏ, lượng huyết sắc tố trung bình hồng cầu (MCH là 24,0) thấp. Chưa loại trừ Thalassemia.  Đề nghị khám và sàng lọc thalassemia. Với kết quả như vậy thì có thể xác định được e đag bị tan máu ở thể nào ạ? có nguy hiểm không và chi phí + thời gian sàng lọc là như thế nào ạ? Hiện e 22tuổi. Em cảm ơn bsĩ 😊",13/05/2019,https://medlatec.vn/hoi-dap/sang-loc-thalassemia-c11-q34013#traloi
Huyết học,tan máu bẩm sinh,Bs giải thích giúp e kết quả này và cần điều trị như thế nào ạ.e cảm ơn!,11/05/2019,https://medlatec.vn/hoi-dap/tan-mau-bam-sinh-c11-q33983#traloi
Huyết học,khám sản,E có khán bên mình bị thế này thỳ phải làm sao ạ. Có cần phải ck e đi xét nghiệm k ạ,11/05/2019,https://medlatec.vn/hoi-dap/kham-san-c11-q33980#traloi
Huyết học,khám thai sản,Cho e hỏi gói khám sàng lọc thalassemia ở bên mình cần khám những gì và chi phí là bao nhiêu ạ. E mới xét nghiệm công thức máu bên mình được đề nghị khám và sàng lọc thalassemia. E hỏi bệnh này có phải xét nghiệm cả chồng k ạ,11/05/2019,https://medlatec.vn/hoi-dap/kham-thai-san-c11-q33978#traloi
Huyết học,Tan máu bẩm sinh,"Chào bs, con gái e 19 tháng tuổi có làm xét nghiệm điện di ở bv medlatec trung tâm thanh hóa, cháu bị chẩn đoán bệnh tan máu bẩm sinh thể alpha. Vậy cho e hỏi dựa vào kết qủa điện di huyết sắc tố có xác định được thể nặng, trung bình hay nhẹ không thưa bs? Vì bsy ở viện huyết học khẳng định cháu bị thể nhẹ, tuy nhiên gđ vẫn ko hiểu cơ sở nào mà bsy bảo vậy, vì thường phải truyền máu dưới 2 tuổi là thể từ trung bình đến nặng, kính mong bs giải đáp giúp e. E có gửi kết quả điện di kèm theo",09/05/2019,https://medlatec.vn/hoi-dap/tan-mau-bam-sinh-c11-q33933#traloi
Huyết học,Chào bác sỹ.,"Chào bác sỹ.
Tôi có đi khám sk thì thấy chỉ số thể tích trung bình Hồng cầu MCv nhỏ 69.6( tc là 80÷100). Chỉ số Huyết sắc tố và các chỉ số khác thì bình thường ạ.
Vậy bác sỹ giải đáp giúp tôi ạ.
Cảm ơn bác sỹ.",09/05/2019,https://medlatec.vn/hoi-dap/chao-bac-sy-c11-q33918#traloi
Huyết học,Tư vấn kết quả xét nghiệm máu,"Kính chào Bác sĩ! Nhờ Bác sĩ tư vấn giúp cháu KQ Mã xét nghiệm 1000122734, cháu thấy có 3 chỉ số về máu tăng ạ, tổng thể KQ xét nghiệm như vậy có vấn đề gì không ạ? Cháu xin chân thành cảm ơn Bác sĩ ạ",08/05/2019,https://medlatec.vn/hoi-dap/tu-van-ket-qua-xet-nghiem-mau-c11-q33888#traloi
Huyết học,Sàng lọc rối loạn chuyển hoá bẩm sinh,"Con em lúc sinh có xét nghiệm máu gót chân - xét nghiệm sàng lọc rối loạn chuyển hoá bẩm sinh, kết quả có chỉ số Serine (Ser) là 528,15 trong khi ngưỡng cho phép từ 73->350. Bác sỹ có khuyến nghị đi đo định lượng acid amin tuy nhiên do con em mới sinh được 19 ngày nên cho em hỏi chỉ số này có ý nghĩa gì? Có cần thiết phải đi đo định lượng acid amin ngay không? Mong các bác sỹ tư vấn giúp em ạ?",03/05/2019,https://medlatec.vn/hoi-dap/sang-loc-roi-loan-chuyen-hoa-bam-sinh-c11-q33828#traloi
Huyết học,Tư vấn chỉ số máu,"Em chào bác sĩ!
Hôm qua em có xét nghiệm máu thai kì tuần thứ 12. Có 2 chỉ số giảm là lượng huyết sắc tố Hb 11.7 (12-15.5) và thể tích khối hồng cầu HCT  36.4 ( 37-42) . Mong các bác sĩ tư vấn giúp e ạ, e bị làm sao và làm gì để cải thiện ạ
Em cảm ơn !",03/05/2019,https://medlatec.vn/hoi-dap/tu-van-chi-so-mau-c11-q33817#traloi
Huyết học,Bất đồng nhóm máu ở trẻ sơ sinh,"Em nhóm máu A-, mới sinh con lần đầu, cháu nhóm RH+, em đẻ ở phụ sản trung ương thì bác sỹ bảo con em bất đồng nhóm máu với em, và có thực hiện test coombs thì con em dương tính nhẹ với test coombs gián tiếp, còn test coombs trực tiếp lại âm tính. Bác sỹ bảo dương tính nhẹ và đang bình thường, em có cần đi xét nghiệm lại không ạ? Cháu được 18 ngày, em đã tiêm Anti-D mũi tuần 28 và sau sinh 72h ạ",02/05/2019,https://medlatec.vn/hoi-dap/bat-dong-nhom-mau-o-tre-so-sinh-c11-q33815#traloi
Huyết học,gen tan máu alpha,"tôi mang gen bệnh tan máu bẩm sinh alpha thể nhẹ, tôi hay bị đau đầu, stress nên có dùng hoạt huyết dưỡng não , thuốc bổ não gingko không biết có ảnh hưởng gì không. tôi 43t, nữ , nên uống bổ sung gì cho thích hợp với tôi. xin trân thành cảm ơn",02/05/2019,https://medlatec.vn/hoi-dap/gen-tan-mau-alpha-c11-q33808#traloi
Huyết học,giải thích kết quả mã 1113513340,Bsi vui lòng giải thích giúp em kết quả phân tích máu và liệu em có bị tan máu bẩm sinh không ạ? Em xin cảm ơn,29/04/2019,https://medlatec.vn/hoi-dap/giai-thich-ket-qua-ma-1113513340-c11-q33780#traloi
Da liễu,HPV,"Em chào bác sĩ! 
Em đã hoàn tất 3 mũi tiêm HPV 6,11,16,18 vào tháng 3. Đến tháng 7 thì có quan hệ bằng miệng và có tiếp xúc bên ngoài với người bị sùi mào gà(đã điều trị và không tái phát lại trong 3 tháng) , vậy e có nguy cơ bị nhiễm bệnh không? Và có cần xét nghiệm gì không?",20/07/2020,https://medlatec.vn/hoi-dap/hpv-c26-q54131#traloi
Da liễu,Da mẩn đỏ nổi mề đay ngứa toàn thân,E bị nổi mề đay ngứa toàn thân sau khi đi khám và xét ngiệm máu thì bác sỹ nói e bị hp dạ dày và viêm gan b vậy bs cho e hỏi có thể trị hai bệnh này cùng lúc đc không ạ,20/07/2020,https://medlatec.vn/hoi-dap/da-man-do-noi-me-day-ngua-toan-than-c26-q54129#traloi
Da liễu,Những nốt nhỏ trên da bụng,Bác ơi cho con hỏi nếu các nốt màu nâu trên da con có hỏi bác là có thể  bị viêm da hoặc bệnh tăng sắc tố da gì đó mà nếu để lâu dài  là nó trở thành nốt ruồi phải k ạ,19/07/2020,https://medlatec.vn/hoi-dap/nhung-not-nho-tren-da-bung-c26-q54074#traloi
Da liễu,Xin được tư vấn cách điều trị,"Vă Nam-20 tuổi
05/05/2017
Chào bác sĩ ! Cháu có bị thâm vùng da ở 2 mép ở miệng, nó khô và rát khi mở miệng quá to thì nó hơi đau rất khó chịu, thỉnh thoảng khô còn chóc vảy da màu trắng. Mong bác sĩ cho cháu biết cháu bị bệnh gì và phải chữa trị ra là sao . Cháu xin cảm ơn!",17/07/2020,https://medlatec.vn/hoi-dap/xin-duoc-tu-van-cach-dieu-tri-c26-q54005#traloi
Da liễu,Da liễu,Thuốc telfast GD 180mg có phải kháng sinh ko ạ thưa bác sĩ,17/07/2020,https://medlatec.vn/hoi-dap/da-lieu--c26-q54004#traloi
Da liễu,Những nốt nhỏ trên da bụng,Bác ơi cho con hỏi sao trên vùng da ở quanh bụng và ngực của con nổi những nốt nhỏ li ti màu nâu là bị gì ạ.nó mọc dạng khô và có thể gãi mạnh là có những nốt nó ra dc.bác cho con xin cách điều trị ạ,15/07/2020,https://medlatec.vn/hoi-dap/nhung-not-nho-tren-da-bung-c26-q53974#traloi
Da liễu,Mụn li ti ở môi,"Chào bác sĩ. Cháu 17 tuổi, gần đây cháu có bị mụn nhỏ li ti hơn đầu kim ở trên môi. Ban đầu cháu mím môi thấy xào xạo(như tay mình có cát đó) thì cháu nghĩ là môi bị khô. Nhưng sau tầm 3-4 ngày thì căng môi ra thì nhìn mới biết là mụn rất rất nhỏ và nhiều hơn lúc trước. Bác sĩ cho cháu hỏi cháu bị sao ạ? Chữa như nào ạ?",15/07/2020,https://medlatec.vn/hoi-dap/mun-li-ti-o-moi-c26-q53951#traloi
Da liễu,Thắc mắc về mụn,Con có mọc cục mụn trên mặt dưới da và khi sờ vào thì cảm thấy nó cứng và màu tím xin tư vấn cách trị,15/07/2020,https://medlatec.vn/hoi-dap/thac-mac-ve-mun-c26-q53926#traloi
Da liễu,Chân chỉ,"Bác sĩ cho e hỏi e cắt bao quy đầu sau khi rút chỉ nay được 1 tháng rồi mà chân chỉ vẫn còn lỗ chân chỉ, da chỗ chân chỉ co lại nhưng không đau. Thì có làm sao không bác sĩ. Chân chỉ đấy có liền lại không hay nó như thế mãi. Cảm ơn bác sĩ",13/07/2020,https://medlatec.vn/hoi-dap/chan-chi-c26-q53881#traloi
Da liễu,Da bị nổi sần và dát,"chào bác sĩ , hôm trc sau khi tắm xong da vùng lưng trên của cháu bắt đầu nổi sần và bị dát . cháu không sử dụng mĩ phẩm và cũng chưa bị dị ứng thời tiết . 
cho cháu hỏi cháu đang mắc bệnh về da gì ạ ?",12/07/2020,https://medlatec.vn/hoi-dap/da-bi-noi-san-va-dat-c26-q53835#traloi
Da liễu,Móng chân bị đau và tím do kẹt cửa,"Thưa bác sĩ, 2 ngày trước móng chân cháu đã bị kẹt cửa và tím gần như toàn bộ móng từ lúc đó luôn ạ. Cháu nghe nói tụ máu như vậy thì cần khám bác sĩ và nếu để tự mọc móng mới thì sẽ rất lâu và xấu. Nhưng mẹ bảo là không nhất thiết và chỉ cần thuốc giảm đau thôi. Cháu nên làm gì đây ạ?",11/07/2020,https://medlatec.vn/hoi-dap/mong-chan-bi-dau-va-tim-do-ket-cua-c26-q53799#traloi
Da liễu,Hỏi về việc cào/cậy nốt ruồi trên mặt,"Thưa bác sĩ, hôm trước khi soi gương con có thấy một nốt đen mờ ở trên mặt, tưởng là mụn đầu đen nên con đã lấy tay cào thử nhưng nốt đen ấy không biến mất và con mới biết đó là nốt ruồi. Sau khi cào, nốt ruồi trở nên đen rõ hơn (lúc trước thì mờ mờ thôi ạ), nhìn thoáng qua là thấy và chổ nốt ruồi có hơi sưng lên, làm mất thẩm mĩ và sự tự tin của con. 
Bác sĩ cho con hỏi liệu vài ngày nữa nốt ruồi đó của con có thể trở lại bình thường (mờ như cũ) hay là sẽ đen rõ như vậy luôn ạ.
Con cảm ơn bác sĩ.",08/07/2020,https://medlatec.vn/hoi-dap/hoi-ve-viec-caocay-not-ruoi-tren-mat-c26-q53647#traloi
Da liễu,"Rốn nổi hột li ti ngứa, có dịch hôi","Cách đây vài ngày, mình có lỡ cậy rốn và bị vài vết xước nhỏ ở rốn. Ngày hôm sau thì rốn bị nổi ít mẩn nước li ti ở vùng lỗ rốn và chảy ít dịch màu trong, khoản 3 ngày thỉ 2 có dịch hơi hôi bôi dầu thì rất rát. Có phải mình bị nhiễm trùng không và cách xử lí ra sao ạ?",06/07/2020,https://medlatec.vn/hoi-dap/ron-noi-hot-li-ti-ngua-co-dich-hoi--c26-q53571#traloi
Da liễu,Mụn thịt trên mặt,Bé nhà mình 3 tuổi mới đầu có 1-2 nốt mụn thịt trên lông mày giờ gần mắt ria mép đều có mà càng ngày càng nhiều  có sao ko ạ mong bs tư vấn giúp với ạ để cho cháu khỏi hết ạ,06/07/2020,https://medlatec.vn/hoi-dap/mun-thit-tren-mat-c26-q53550#traloi
Da liễu,Bệnh da liễu,"Chào bác sĩ,3 tháng nay tôi bị nổi mụn nước li ti khắp vùng bụng,ngực và lưng,kèm theo ngứa,tôi vừa sinh mổ được 9 tháng,xin hỏi tôi đã bị gì và hướng chữa trị như thế nào ạ,xin cảm ơn!",06/07/2020,https://medlatec.vn/hoi-dap/benh-da-lieu-c26-q53531#traloi
Da liễu,Uống thuốc da liễu điều trị mụn,"Chào bác sĩ!
Em đã thăm khám và uống thuốc điều trị mụn trứng cá (bị ít) đồng thời làm giảm tàn nhang giúp đẹp da được hơn 2 năm nay. Tuy nhiên, chỉ vừa ngưng uống thuốc được 5 ngày là da e bắt đầu xấu hẳn. Mụn li ti nổi lên, da sạm và đen liền, lỗ chân lông cũng bắt đầu to ra. 
Vậy cho e hỏi tại sao lại xảy ra tình trạng đó? Và nếu như vậy thì em phải uống thuốc trọn đời ạ?",19/06/2020,https://medlatec.vn/hoi-dap/uong-thuoc-da-lieu-dieu-tri-mun-c26-q52707#traloi
Da liễu,Bị mẩn ngứa ở ngón tay,"Cháu chào bác sĩ. Khoảng 2 tuần nay ngón giữa và ngón đeo nhẫn bên tay trái của cháu bị nổi mẩn lên và có các chấm li ti màu đỏ dưới chỗ bị nổi mẩn, nhìn rất giống vết máu lúc bị bầm ý ạ. Da cháu lúc đầu rất ngứa rát và bây giờ thì nó bị bì bì và hơi sưng ngón tay lên ạ. Đến nỗi bây giờ cháu còn ko nắm được khít tay vào ạ . Lúc đầu cháu còn tưởng do da khô nên bôi kem tay trước khi đi ngủ nhưng vẫn không thấy đỡ ạ. Mong bác sĩ bắt bệnh và tư vấn giúp cháu với ạ. Cháu cảm ơn bác sĩ nhiều ạ!",18/06/2020,https://medlatec.vn/hoi-dap/bi-man-ngua-o-ngon-tay-c26-q52699#traloi
Da liễu,Chữa bệnh,Tôi đi khám tại bệnh viện kí sing trùng nghẹ an được kết luận bị nhiễm giun sán chó mèo được bác sĩ kê thuốc uống nhưng uống vào bệnh lại nặng thêm. Ngứa toàn thân luôn bác sĩ . Thước kê gồm có thuốc đặc trị giun sán thuốc chống ngứa thuốc hổ trợ gan. Vậy xin hỏi bác sĩ như vậy coa đúng bệnh ko cách điều trị như thế nào. Cảm ơn bác sĩ,18/06/2020,https://medlatec.vn/hoi-dap/chua-benh-c26-q52691#traloi
Da liễu,Da liễu,Cháu có cậy rốn do lỡ tay nên cháu cào mạnh quá làm cho rốn bị chảy dịch màu trong suốt đến bây giờ vẫn chưa thấy lành mong bác sĩ tư vấn giúp cháu phải làm sao ạ?,18/06/2020,https://medlatec.vn/hoi-dap/da-lieu--c26-q52682#traloi
Da liễu,Móng tay,"Cháu chào bác sĩ, năm nay cháu 17 tuổi. Tầm khoảng nửa năm trước móng tay cháu bị tách lớp và sau đó đã mọc lại nhưng phần mọc lại bên kẽ trái và bên trên không dính vào thịt và có màu trắng đục. Vậy móng tay của cháu bị làm sao và có khắc phục được không ạ?
Đây là ảnh của móng tay cháu https://photos.app.goo.gl/yVFJKG5phANRVNxm6",17/06/2020,https://medlatec.vn/hoi-dap/mong-tay-c26-q52624#traloi
Da liễu,Hai,Chào bs cho e hỏi bé nhà e dc hơn 6th r . Sinh cháu dc gần tháng thì chán của cháu có 1 nửa chán trắng hơn  so mới da nh8fn mờ mòe k rõ lắm. Bjo dc hơn 6th càng ngày càng thấy trắng rõ là bị sao ạ .,16/06/2020,https://medlatec.vn/hoi-dap/hai-c26-q52596#traloi
Da liễu,Những nốt nước trong li ti xuất hiện trên môi,"Sau khi ngủ dậy tôi phát hiện ra trên môi có mọc những nốt nước trong li ti khắp xung quanh viền môi, bên cạnh đó còn có những đốm trắng nhỏ ẩn li ti dưới môi, không có biểu hiện rát ngứa hay đỏ. Sau đó tôi đã tự nặn bằng tay và những nốt này khô lại. Sau một thời gian thì những nổ này lại mọc lên vậy tôi muốn hỏi bệnh gì và cách khắc phục",16/06/2020,https://medlatec.vn/hoi-dap/nhung-not-nuoc-trong-li-ti-xuat-hien-tren-moi-c26-q52578#traloi
Da liễu,Nổi mề đay,"Em bị nổi mề đay, em có đi xét nghiệm, thì kết quả nhiễm giun lươn, giun đầu gai, sán lá gan lớn. Bác sĩ kê đơn thuốc: ivermectin 6mg, và Triclabendazole tablets 250mg( cách 1 tuần sau mới uống khi uống xong thuốc ivermectin), và telfast 60g( uống khi ngứa). Cho em hỏi 2 loại thuốc trị giun ở trên , em có cần uống thêm thuốc hỗ trợ gan thêm không ạ. Và cách uống như thế nào trong quá trình sử dụng thuốc ạ.",15/06/2020,https://medlatec.vn/hoi-dap/noi-me-day-c26-q52539#traloi
Da liễu,da liễu,"Chào bác sĩ,cháu bị dị ứng nổi chàm ở chân và tay. Cháu có uống thuốc và bôi thuốc Lotusone được 1 tuần thì thấy đã đỡ đi nhiều. Tuy nhiên cháu thấy các vết chàm này bị chuyển thâm đen mà con bôi thử kem nghệ nhưng thấy không đỡ. bác cho cháu hỏi cháu phải bôi thêm gì hay làm gì để giảm thâm không ạ.",15/06/2020,https://medlatec.vn/hoi-dap/da-lieu-c26-q52528#traloi
Da liễu,Nổi nốt đỏ,"E chào Bs e năm nay 20 t từ tháng 3 đến nay e xuất hiện trên tay chân và khắp người những nốt đỏ và rất ngứa, e có đi xét nghiệm t4 kq là %lym 43.5 %mono 9.3 Neu45.8 tiểu cầu 10.0 Pdw 12.4 Eo 0.08 và %Eo 1.2  có uống thuốc Aleradin 1 tháng nhưng vẫn nổi liên tục từng ngày. Vừa t6 đây e co đi xn lại thì % Lym 49.8  Bs xem giúp e bị gi và cách điều trị để bớt nổi và ngứa hơn ah. E xin cảm ơn",15/06/2020,https://medlatec.vn/hoi-dap/-noi-not-do--c26-q52512#traloi
Da liễu,Cần bác sĩ tư vấn,"Chào bác sĩ ! Cháu có bị thâm vùng da ở 2 mép ở miệng, nó khô và rát khi mở miệng quá to thì nó hơi đau rất khó chịu, thỉnh thoảng khô còn chóc vảy da màu trắng. Mong bác sĩ cho cháu biết cháu bị bệnh gì và phải chữa trị ra là sao . Cháu xin cảm ơn!",12/06/2020,https://medlatec.vn/hoi-dap/can-bac-si-tu-van-c26-q52424#traloi
Da liễu,Bị dị ứng sốt và ngứa dông đốt,Bác sĩ ơi cho em hỏi mỗi lần em bị ông đốt em em bị sốt đến 39 độ lần này em bị ông mật đốt ngay gan bàn chân do dẫm đâu no trong nha. 2 hôm rồi hnay em bị sốt cao . Em gai lam gì thưa bác sĩ,12/06/2020,https://medlatec.vn/hoi-dap/bi-di-ung-sot-va-ngua-dong-dot-c26-q52416#traloi
Da liễu,Da liễu,"Cháu bị một cục sưng trên trái dương nó cứ xẹp đi rồi nổi lại, sờ vào mềm hơi đau đó có phải là mụn không ạ",11/06/2020,https://medlatec.vn/hoi-dap/da-lieu-c26-q52363#traloi
Da liễu,..,"Chào bác sĩ ! Cháu có bị thâm vùng da ở 2 mép ở miệng, nó khô và rát khi mở miệng quá to thì nó hơi đau rất khó chịu, thỉnh thoảng khô còn chóc vảy da màu trắng. Mong bác sĩ cho cháu biết cháu bị bệnh gì và phải chữa trị ra là sao . Cháu xin cảm ơn!",11/06/2020,https://medlatec.vn/hoi-dap/-c26-q52348#traloi
Da liễu,Vết đỏ tròn trên 2 cẳng chân,"Chào bác sĩ. Mẹ em năm nay 61 tuổi, tuần trước sau khi đi rẫy về thì trên 2 cẳng chân (từ mắt cá đến đầu gối) nổi lên các vết đỏ tròn có đường kính từ 2-4cm. Màu và hình dạng giống như vết giác hơi, có hơi ngứa, không sưng, không tróc da. Mẹ em uống thuốc dị ứng mề đây thì có đỡ ngứa, nhưng khoảng 5 ngày rồi các vết này cũng còn đỏ, không thấy phai màu. Cho em hỏi này là mẹ em bị gì ạ? Cảm ơn bác sĩ.",11/06/2020,https://medlatec.vn/hoi-dap/vet-do-tron-tren-2-cang-chan-c26-q52336#traloi
Da liễu,Da liễu,Dạ chào bác sĩ. Thưa bác sĩ em có đó khám ở 1 phòng khám có kết quả xét nghiệm soi tươi tế bào biểu mô(++) thì nghĩa là như thế nào ạ. Em cảm ơn ạ.,31/05/2020,https://medlatec.vn/hoi-dap/da-lieu-c26-q51795#traloi
Da liễu,"Nốt nhỏ, cứng ở sau gáy","Bác sĩ ơi em có nổi một nốt nhỏ cứng cứng ở phần da sau gáy, bên ngoài nhìn vào thấy đen đen, sờ vào thì thấy cứng cứng, cho em hỏi đó là gì ạ",31/05/2020,https://medlatec.vn/hoi-dap/not-nho-cung-o-sau-gay-c26-q51794#traloi
Da liễu,Cần tư vấn về da :(,"Cánh tay phải có vài đốm trắng nhỏ là bị gì ạ
Lúc trước có nổi hột nhỏ như mụn sau đó hột đó vỡ ra để lại đốm trắng là sao ạ :((",30/05/2020,https://medlatec.vn/hoi-dap/can-tu-van-ve-da--c26-q51773#traloi
Da liễu,Nốt mụn bị nổi đỏ đô dùng kem đánh răng,"Em có đọc trên mạng là dùng kem đánh răng có thể trị mụn được nên sau khi rửa mặt với sữa rửa mặt em đã bôi kem đánh răng lên các nốt mụn và bỏ qua đêm , vào sáng hôm sau khi rửa đi lớp kem đánh răng em cảm thấy rát ở các nốt mụn và sau đó là sưng đỏ ở các chỗ mà em đã bôi kem đánh răng lên và đôi khi cảm thấy ngứa. Em rấ mong được tư vấn vì em có đọc vài thôg tin trên mạng thì được biết là em đang bị bỏng da đỏ trong kem đánh rắng có chứa chất tẩy trắng ạ
 Em mong được tư vấn cách điều trị ạ",30/05/2020,https://medlatec.vn/hoi-dap/not-mun-bi-noi-do-do-dung-kem-danh-rang-c26-q51746#traloi
Da liễu,Bị ngứa lở tay,"Bác sĩ ơi e bị sưng ngứa ở tay, có nơi xuất hiện các chấm máu li ti quanh ngón tay. Bác sĩ cho e hỏi e bị bệnh gì ạ? E xin cảm ơn bác sĩ nhiều",28/05/2020,https://medlatec.vn/hoi-dap/bi-ngua-lo-tay-c26-q51680#traloi
Da liễu,ĐAU DƯỚI VÙNG NÁCH,"Trước đây tầm 4 tháng vùng da dưới cánh tay của em khi sờ vào thấy một cục nhỏ và đau. Sau khi đi khám một lần qua siêu âm, thì không thấy có u hay gì phía dưới. Bác sĩ bảo bị viêm sưng do bí tắc lỗ chân lông, tổn thương vùng da phía dưới. Cho e đơn thuốc uống và sau đó khỏi, khi sờ không còn đau hay thấy bất kì gì..... Nhưng hơn 1 tuần nay thì trường hợp ấy lại xuất hiện và khi sờ vào đau hơn trước nhiều. Mong cho em tư vấn ạ, em đang rất lo lắng. Em cảm ơn nhiều ạ",27/05/2020,https://medlatec.vn/hoi-dap/dau-duoi-vung-nach--c26-q51647#traloi
Da liễu,Mụn đinh râu,"cho em hỏi là em có bị mụn đinh râu, em có để nó bưng mủ rồi nặn ra nhưng vì em không biết nên chưa nặn ra cái đinh của mụn. Em để vậy cho đến bây giờ mụn nó lại chồi lên em phải làm sao ạ? cái này là mụn cũ em chưa nặn hết hay là mụn mới ạ ?",27/05/2020,https://medlatec.vn/hoi-dap/mun-dinh-rau-c26-q51620#traloi
Da liễu,Vấn đề về virus HSV,"Cháu năm nay 21 tuổi cháu có đi xet nghiệm HSV thì có kết quả(HSV 1/2 IgG 8,20 dương tính và igM 5,0 âm tính) cháu muốn biết phương pháp điều trị ạ,cháu mong bác sĩ phản hồi cháu came ơn ạ",27/05/2020,https://medlatec.vn/hoi-dap/van-de-ve-virus-hsv-c26-q51614#traloi
Da liễu,Da nổi nhiều nốt như muỗi cắn và ngứa,"Thưa bác sĩ, cánh tay em có nổi 6-7 nốt cách xa nhau như muỗi cắn và rất ngứa. Và mỗi ngày lại nổi thêm 1-2 nốt. Cho em hỏi đấy là bị gì ạ?",27/05/2020,https://medlatec.vn/hoi-dap/da-noi-nhieu-not-nhu-muoi-can-va-ngua-c26-q51588#traloi
Da liễu,Kính mong bs tư vấn,"Bs cho cháu hỏi, cháu tắm rửa sạch sẽ, mà cơ thể vẫn nặng mùi, dù k ra hoặc đổ rất ít mồ hôi là bị bệnh gì. Cháu phải khám ở đâu ạ và khám ở khoa nào  kính mong bs tư vấn giúp ạ",26/05/2020,https://medlatec.vn/hoi-dap/kinh-mong-bs-tu-van-c26-q51559#traloi
Da liễu,bác sĩ xem giúp em chỉ số này với ạ,"Em xét nghiệm máu vì bị dị ứng!Chỉ số EO% 0-8% kết quả 3,7. Bác sĩ gạch ngang mà em không hiểu có vấn đề gì không ạ?",24/05/2020,https://medlatec.vn/hoi-dap/bac-si-xem-giup-em-chi-so-nay-voi-a-c26-q51489#traloi
Da liễu,Bệnh,Tôi muốn mua thuốc trị mụn niowcs sinh dục herpes nam,24/05/2020,https://medlatec.vn/hoi-dap/benh-c26-q51486#traloi
Da liễu,Nóng người và ngứa,"Em bị nóng người và ngứa ngáy, nổi mụn( những chấm đỏ nhỏ nhỏ) ở gần bẹn và đang lan ra. Xuất hiện mụn ở bộ phận sinh dục",24/05/2020,https://medlatec.vn/hoi-dap/nong-nguoi-va-ngua-c26-q51433#traloi
Da liễu,hỏi về bệnh da,da bị đốm trắng như đầu ngón tay trên mặt lưng là bệnh gì? cách chữa trị?,23/05/2020,https://medlatec.vn/hoi-dap/hoi-ve-benh-da-c26-q51400#traloi
Da liễu,Viên uống trị mụn,"Viên uống đẹp da, cân bằng nội tiết tố nữ, viên uống collagen có thực sự tốt và không để lại tác dụng phụ không ạ? Có một số thông tin nói là uống thuốc trị mụn sẽ gây ra quái thai... Em đang quan tâm đến Viên uống trị mụn FANCL của Nhật có an toàn không ạ? Mong bác sĩ trả lời giúp em ạ",22/05/2020,https://medlatec.vn/hoi-dap/vien-uong-tri-mun-c26-q51358#traloi
Da liễu,Mất cảm giác nửa đầu ngón tay,"Chào Bác sĩ,
Đợt rồi tôi bị tai nạn, bị đứt tay bên mép giữa đốt thứ 1 và thứ 2( đếm từ trên xuống). Đi bệnh viện có may lại 2 mũi, hiện đã tháo chỉ, nhưng 1 nửa đốt ngón tay bên bị may chỉ thì ko có cảm giác, rờ mạnh vào chỗ vết khâu có cảm giác tê buốt. Bác sĩ cho tôi hỏi có thể hồi phục và hết cảm giác tê buốt ko ạ, từ khi tháo chỉ tôi đã đc hơn 1 tuần. Cảm ơn Bác sĩ.",29/04/2020,https://medlatec.vn/hoi-dap/mat-cam-giac-nua-dau-ngon-tay-c26-q50188#traloi
