category,question_title,question_content,question_date,question_url
Cơ xương khớp,Bệnh tan máu bẩm sinh,"Con gái em giờ 15 tháng nặng 10.5kg. Cháu xét nghiệm bị tan máu bẩm sinh dạng nhẹ chỉ số hbA 95.3% ( chỉ số bt là 96.8 -97.8%.
Chỉ số hb F 2.1 ( chỉ số bt là =< 1.5)
Chỉ số hbA2 bình thường. Như vậy chỉ số này có nguy hiểm không và có cách chữa trị dứt điểm không ah",28/07/2020,https://medlatec.vn/hoi-dap/benh-tan-mau-bam-sinh-c9-q54515#traloi
Cơ xương khớp,Gãy xương,"Gãy xương trụ tay tráii bóp thuốc có hết ko ạ
Hay phải mổ ạ
Em cảm ơn",27/07/2020,https://medlatec.vn/hoi-dap/gay-xuong-c9-q54494#traloi
Cơ xương khớp,KHám sức khoẻ định kì,Bên bạn đang có chueowng trình khuyến mại lấy máu xét nghiệm khám đụnh kì không ạ?,27/07/2020,https://medlatec.vn/hoi-dap/kham-suc-khoe-dinh-ki-c9-q54480#traloi
Cơ xương khớp,Chiều dài xương đùi,"Chào bác sĩ, bé nhà em đc 35 tuần chiều dài xương đùi 62mm, bác sĩ chuẩn đoán là ngắn, liệu bé nhà e có bị mắc hội chứng down và có nguy hiểm ko ah?",26/07/2020,https://medlatec.vn/hoi-dap/chieu-dai-xuong-dui-c9-q54459#traloi
Cơ xương khớp,Biến chứng của còi xương,"Cháu tên hoàn năm nay 17 tuổi hồi bé cháu lười ăn nên rất là gầy lên cấp 2 cũng vậy cháu hay bỏ bữa không màng đến chế độ ăn uống hè lớp 9 cháu phát hiện xương lồng ngực bất thường và bị lõm xuống do không thấy ảnh hưởng gì nên cháu không đi khám đến hè lớp 11 thấy hơi khó chịu  thì cháu bảo mẹ cho đi khám, sau bao nhiêu xét nghiệm chụp chiếu thì bác sĩ kết luận là do biến chứng của còi xương cháu phải bổ xung chế độ ăn đầy đủ vitamin đặc biệt là D và Canxi. Cháu muốn hỏi sau khi cháu hết suy dinh dương thì lồng ngực của cháu có hết bị ảnh hưởng và đỡ lõm hơn không, chỉ số đo khi chụp cắt lớp là 2,9. hiện tại cháu 17 tuổi cao 1m65 43kg ạ",26/07/2020,https://medlatec.vn/hoi-dap/bien-chung-cua-coi-xuong-c9-q54443#traloi
Cơ xương khớp,Tư vấn về chiều cao,"Cháu chào cô, cháu năm nay 13 tuổi cao 1m47 cháu cần ăn uống vào tạo thói quen sinh hoạt như thế nào để phát triển tối đa về chiều cao ạ. Trong tương lai, sau tuổi dậy cháu cao như thế nào, có nên dùng thuốc tăng chiều cao ko ạ. Mong cô tư vấn. Cháu cảm ơn nhiều",26/07/2020,https://medlatec.vn/hoi-dap/tu-van-ve-chieu-cao-c9-q54433#traloi
Cơ xương khớp,Liệu có phải xương tay sau khi gãy bị lệch hay không?,"Tôi bị gãy xương dưới khớp xoay cổ tay. Đã tháo bột được 5 ngày. Nhưng sau 5 ngày tay vẫn bị lệch như lúc mới gãy, tay k gập hẳn và k ngửa ra được như tay bt. Hơn nữa k thấy xương mắt cá ở cổ tay nổi, sờ cũng k thấy. Bình thường xương sẽ lõm ở phía mặt trong cổ tay, nhưng tay tôi lại lồi ra. Bàn tay bị nghiêng về bên phải xo với trục xương cổ tay( gãy tay phải), ngón tay út thì luôn có cảm giác căng. Mặc dù gãy trục xương phía trong nhưng phía ngoài khi cử động cũng rất đau.",26/07/2020,https://medlatec.vn/hoi-dap/lieu-co-phai-xuong-tay-sau-khi-gay-bi-lech-hay-khong-c9-q54425#traloi
Cơ xương khớp,Đau đầu,"cháu 20 tuổi vài tháng gần đây cháu hay bị đau đầu ở đằng sau phía dưới gần gáy , hay đau bên trái , và đau theo kiểu nhói giật thành nhịp , kéo dài khoảng 30' đến vài tiếng , nếu vừa hoạt động mạnh thì càng đau hơn , di chuyển cũng đau ạ 
   Bác sĩ cho cháu hỏi cháu đang gặp vấn đề gì ạ ?",25/07/2020,https://medlatec.vn/hoi-dap/dau-dau-c9-q54406#traloi
Cơ xương khớp,Chiều cao,"Em là nam năm nay 15 tuổi, nhưng chỉ cao 1m56 Mong được các cô chú tư vấn",25/07/2020,https://medlatec.vn/hoi-dap/chieu-cao-c9-q54395#traloi
Cơ xương khớp,Hỏi về mắt,"Trước đó em mua lens không phù hợp mat thì em có đổi lại và dùng hãng khác sau đó L em đeo lens được 6 tháng hơn mấy vấn ổn không vấn đề gì. 
Gần đây lens hết hạn nên em mua mới cũng chỗ đó thì lần này bị lại chỉ mỗi mắt bên phải bị đỏ và cộm sau khi tháo. Lúc nhỏ em có bị tai nạn miếng giâm trên nóc rớt xuống mắt từ bé phải đi mổ. Nhưng trước đó em dùng lens vẫn ổn nhưng bây giờ em bị như vậy là sao ạ em mua hẳn 2 cặp để thử và 2 cặp vẫn bị ạ",25/07/2020,https://medlatec.vn/hoi-dap/hoi-ve-mat--c9-q54386#traloi
Cơ xương khớp,Gay tay,Gay tay sau bao lau co the lanh lai duoc? Va nuc nao thi co the di lam duoc a?,25/07/2020,https://medlatec.vn/hoi-dap/gay-tay-c9-q54359#traloi
Cơ xương khớp,Mong các chuyên gia tư vấn giùm em ạ,Em mới bị té xe bị xưng phần khớp vai mỗi khi nằm xuống hay ngồi dậy thì thấy chóng mặt xung quang quay vòng tròn Vài giây ạ,24/07/2020,https://medlatec.vn/hoi-dap/mong-cac-chuyen-gia-tu-van-gium-em-a-c9-q54346#traloi
Cơ xương khớp,Mong các chuyên gia tư vấn giùm em ạ,Em mới bị té xe bị xưng phần khớp vai mỗi khi nằm xuống hay ngồi dậy thì thấy chóng mặt xung quang quay vòng tròn Vài giây ạ,24/07/2020,https://medlatec.vn/hoi-dap/mong-cac-chuyen-gia-tu-van-gium-em-a-c9-q54345#traloi
Cơ xương khớp,sưng cục to gần xương cụt,"Thưa bác sĩ, cháu là nam, năm nay 18 tuổi. Hôm trước, cháu có phát hiện mình bị đau ở phần xương cụt, nhưng đau không đáng kể và cháu nghĩ là do ngồi quá nhiều nên mới vậy. Đến hôm nay, cơn đau vẫn chưa dứt, mặc dù không có dấu hiệu tăng thêm, và cháu phát hiện một cục cứng nổi lên ở phần bên phải tại vị trí xương cụt, ấn vào thấy đau nhiều. Cháu không bị sốt, ăn uống đi lại vẫn bình thường, chỉ có điều ngồi và nằm thì nếu trúng cái cục đó sẽ đau. Bác sĩ cho cháu hỏi cháu bị như vậy là sao, và có cần điều trị gì không ạ?",21/07/2020,https://medlatec.vn/hoi-dap/sung-cuc-to-gan-xuong-cut-c9-q54208#traloi
Cơ xương khớp,Mụn ở trẻ em,"Chào bs. Bs cho tôi hỏi bé nhà tôi 6 tuổi bị nốt mụn thịt trên mặt, mới đầu 1 nốt trên sống mũi dần dần lan ra nhiều   Bây giờ khoảng gần 20 nốt rồi. Như thế phải làm sao ạ? Và có thuốc gì bôi khỏi không ạ?",21/07/2020,https://medlatec.vn/hoi-dap/mun-o-tre-em-c9-q54206#traloi
Cơ xương khớp,Ống hút chân không,"Hôm nay em đi khám sức khỏe bác sĩ có lấy máu cho em bằng ống hút chân không,dây và kim tiêm là mới nhưng ống hút chân không khi quan sát e cảm thấy nó dã được sử dụng qua nhiều lần,bác sĩ cho e hỏi nếu người sử dụng ống hút chân không trước em bị mắc hiv hoặc viêm gan B thì e có khả năng lấy nhiễm k ạ?",21/07/2020,https://medlatec.vn/hoi-dap/ong-hut-chan-khong--c9-q54201#traloi
Cơ xương khớp,Giật chân tay khi ngủ,Bé ngủ chân tay hay giật vậy có nguy hiểm ko ạ,21/07/2020,https://medlatec.vn/hoi-dap/giat-chan-tay-khi-ngu--c9-q54200#traloi
Cơ xương khớp,Bạch cầu,"Xin chào bác sĩ:
Ngày 14/6/2020 cháu có khám bệnh tại phòng khám đa khoa.
 +Có làm xét nghiệm máu có kết quả là:
WBC : 12.7 > Bình thường:4-11 G/l
GRAN : 10.2 > bình thường: 1.5-7.5 G/l
LYM % : 16.4 > bình thường: 20-55 %
GRAN%:79.8 > bình thường 35-75 %
 +Xét nghiệm nước tiểu kết quả là:
KET 40 mmol/L
Lúc khám cháu đang mang thai 25 tuần ạ. Hiện tại thai của cháu là 30 tuần ạ.
Bác sĩ tư vấn giúp cháu kết quả như vậy cháu có bị làm sao không ạ, có ảnh hưởng gì đến sức khoẻ của mẹ và bé không ạ.?
Cháu xin chân thành cảm ơn bác sĩ ạ.",21/07/2020,https://medlatec.vn/hoi-dap/bach-cau-c9-q54195#traloi
Cơ xương khớp,Xét nghiệm hiv pcr,Chào bác sĩ. Khoảng gần 2 tuần trước em có hành vi nguy cơ phơi nhiễm hiv. Hiện tại em vô cùng lo lắng mất ăn mất ngủ. Em dự định khi tròn 2 tuần kể từ khi có nguy cơ sẽ đi xét nghiệm hiv pcr để an tâm phần nào. Theo bác sĩ xét nghiệm pcr ở thời điểm như vậy có thể an tâm được bao nhiêu % ạ. Em tìm hiểu ở trên mạng thì từ tuy ngày 28 mới có thể an tâm về kết quả nhưng từ ngày 15 đã có thể đi xét nghiệm hiv combo đúng không ạ. Mong bác sĩ giải đáp cặn kẽ.,21/07/2020,https://medlatec.vn/hoi-dap/xet-nghiem-hiv-pcr-c9-q54170#traloi
Cơ xương khớp,Xin tư vấn,"Chào bác sĩ.
Gia đình e có người bị đau tức ngực cũng được 1 thời gian, đau ở vùng giữa ngực cách mũi ức 3 khoắt ngón tay. nay ửng đỏ ra bề mặt da, đau tăng hơn đôi khi kèm theo khó thở. Đau âm ỉ không lan, đau tăng khi ngủ dậy. Cảm giác lồng ngực căng nhiều khí.
Vậy cho e hỏi BN đang gặp vấn đề gì ạ.",21/07/2020,https://medlatec.vn/hoi-dap/xin-tu-van-c9-q54167#traloi
Cơ xương khớp,Helo,"mình bị bầm tìm ngay mắt, đã hết sưng nhưng vết màu thâm đen vẫn ko hết gần hai tháng rồi ạ",20/07/2020,https://medlatec.vn/hoi-dap/helo-c9-q54155#traloi
Cơ xương khớp,Cho em hỏi,"Chào bác sĩ, bốn hôm nay tôi đi ngoài có lúc phân dẹt như ngón tay cái , thành khuôn. phân vàng không nhày , tô không đau bụng, không sút cân , không chán ăn, 2 hôm mới đây tôi thấy chóng mặt nhưng ngủ dậy là hết , tôi đang bị dạ dày trào ngược , bác sĩ cho tôi hỏi đấy là triệu chứng của bệnh gì",20/07/2020,https://medlatec.vn/hoi-dap/cho-em-hoi--c9-q54133#traloi
Cơ xương khớp,Trẻ đi phân xanh nhầy,"Dạ các bác sĩ cho e hỏi với ạ.bé nhà e được 4 tháng rồi mà 5 ngày nay bé đi phân xanh nhầy lợn cợn các hạt trắng.ngày nào bé cũng đi đúng 3 lần sáng chiều tối.bé không quấy khóc, ngủ bình thường.bú ít hơn bình thường ạ.mong các bác cho e lời khuyên với ạ",19/07/2020,https://medlatec.vn/hoi-dap/tre-di-phan-xanh-nhay-c9-q54126#traloi
Cơ xương khớp,Xin được hỏi các vấn đề liên quan đến HIV,"Xin chào bác sĩ! Em là nam giới, 22 tuổi, cách đây gần 6 tháng có xăm mình, trước khi xăm người thợ có cạo lông vùng cần xăm, do sơ ý nên em đã không xem đầu dao cạo đã được thay chưa (thường thì người thợ sẽ thay ạ). Sau một thời gian thì em có bị sốt nhẹ, khoảng 2 ngày thì khỏi, không có các triệu chứng sớm khác của HIV. 
  Cho em hỏi, giả sử như lưỡi dao cạo chưa được thay thế, vậy khả năng lây nhiễm có cao không? Có khi nào màu còn trên lưỡi dao dùng không bị cắt nhưng lại đi vào theo đường kim xăm?
  Sau gần 6 tháng thì hôm nay (19/7) em sờ thấy hạch hơi nổi, không nhìn thấy, liệu có phải bây giờ mới có thêm triệu chứng? 
  Em cảm ơn bác sĩ!",19/07/2020,https://medlatec.vn/hoi-dap/xin-duoc-hoi-cac-van-de-lien-quan-den-hiv-c9-q54106#traloi
Cơ xương khớp,Đau quay hàm trái,Chào bác sĩ e bị đau quay hàm bên trái được 2 hôm rồi khi há miệng thì đau không há to miệng được e không biết lý do đau là gì ạ bác sĩ cho e hỏi bị đau như thế có ảnh hưởng gì không ạ?,19/07/2020,https://medlatec.vn/hoi-dap/dau-quay-ham-trai-c9-q54081#traloi
Cơ xương khớp,Sán lá gan lớn,"Bác sĩ cho e hỏi e hay bị dị ứng nổi mề đay hơn 10 năm nay , bây giờ e mới phát hiện e bị sán lá gan lớn có nhiều ổ to ,e đã uống thuốc giun sán rui được 15 ngày nay e vẫn hay bị đau dưới hạ sườn phải và cơ thể rất mệt mỏi",19/07/2020,https://medlatec.vn/hoi-dap/san-la-gan-lon-c9-q54080#traloi
Cơ xương khớp,Tư vấn giúp em,Chào bác sĩ ạ hôm nay đi khám và siêu âm thai nhi  28 tuần 6 ngày .BS âm kết quả não thất bên trái 11cm não thất bên phải 12cm có nguy hiểm ko ạ?,19/07/2020,https://medlatec.vn/hoi-dap/tu-van-giup-em-c9-q54078#traloi
Cơ xương khớp,Tieu duong thai ki,Hoi ve benh tieu duong thai ki,18/07/2020,https://medlatec.vn/hoi-dap/tieu-duong-thai-ki-c9-q54059#traloi
Cơ xương khớp,Dùng thuốc dupbaston để có kinh,Cháu bắt đầu có kinh từ năm 15t nhưng đến năm 16t vẫn chưa có lại. Đi khám thì bác sĩ kê cho thuốc dupbaston để có kinh lại. Nhưng thuốc ghi không dùng cho người dưới 18t.Cháu nên làm gì bh ạ? Có nên uống thuốc k? Uống có sao k ạ ?,14/07/2020,https://medlatec.vn/hoi-dap/dung-thuoc-dupbaston-de-co-kinh-c9-q53898#traloi
Cơ xương khớp,THAI THƯONG KO KHOẺ,"Lần đầu e có thai mà ko biết - 2015 - sau 10 ngày thai tự tuột do áp lực tâm lý - mất ngủ.
Lần 2 - Em bé đã có hình hài - bé trai 3 tháng 17 ngày 
Lần này cũng do tâm lý - tinh thần bất ổn - suy nghĩ nhìu- thậm chí cơ thể lúc nào cũng thấy khó chịu và em bé đã tắt thở trong thai mà ko biết ! 
Xin hỏi Bác sĩ nguyên nhân là do tinh thần của người Mẹ cũng rất quan trọng đến sự sống của con cái? Xin cho em biện pháp để hĩu rõ và kinh nghiệm sau này ko phải bị vướng phải như hai trường hợp trên- xin chân thành cảm ơn Bác Sĩ!",14/07/2020,https://medlatec.vn/hoi-dap/thai-thuong-ko-khoe-c9-q53895#traloi
Cơ xương khớp,Đau tức ngực giữa,"Thưa bác sĩ. Cho cháu được hỏi là cháu 5 tháng trở lại đây cháu thỉnh thoảng bị đau tức ngực giữa. Kéo dài 2-3 ngày. Ưỡn ngực là nhói,cúi người là nhói...cháu có hút thuốc lá và đợt này cháu hay lo hay suy nghĩ..vậy cháu xin hỏi cháu có thể mắc bệnh gì hay như thế nào ko ạ",13/07/2020,https://medlatec.vn/hoi-dap/dau-tuc-nguc-giua-c9-q53888#traloi
Cơ xương khớp,Cần tư  vấn,"E chào  bác  sĩ  !! Hum  nay  e đi  khám  thai đc  4 tuần  nhưng  bác  sĩ  có  nang  kích  thước  7,7-7,2mm vậy  nang  này  có  ảnh  hưởng  gì  đến  thai  nhi  ko ạ  và  bác  sĩ  có  thể  tư  vấn  cho  mình  phương  hướng  điều  trị  ko  ah",13/07/2020,https://medlatec.vn/hoi-dap/can-tu--van--c9-q53884#traloi
Cơ xương khớp,Đã khám tại trường,"Cho e hỏi e có khả năng mắc bệnh gì? Khi Tỉ lệ% bạch cầu Mono 1.7 (4.0-8.0)
Số lượng bạch cầu lympho 3.6 (0.6-3.4)
Các chỉ số khác ở mức độ bình thường.
Trân thành cảm ơn!",13/07/2020,https://medlatec.vn/hoi-dap/da-kham-tai-truong-c9-q53883#traloi
Cơ xương khớp,N,em đi khám bác sĩ nói em bị 2 nang buồng trứng phải 29mm. nhưng bác sĩ nói là nang sinh lý. em rất hoang mang. xin hãy cho em biết e cần làm gì.,13/07/2020,https://medlatec.vn/hoi-dap/n-c9-q53878#traloi
Cơ xương khớp,đau cổ sau gáy,mỗi sáng dậy là đau cổ sau gáy mẹo chữa là gì,13/07/2020,https://medlatec.vn/hoi-dap/dau-co%CC%89-sau-gay-c9-q53868#traloi
Cơ xương khớp,Hiv,Em rất hoang mang. E làm ở bvien. 1ca nvien sau do xnghiem là dương tính giai đoạn cuối. E rất can thận. Em trực sáng e thức đây cũng chuyển bệnh mổ và do huyết áp 15ca. E đều mang g2 cặp găng. Ca đó e cũng mag thêm găng vo trứng. Do xong e về tháo găng ra e rửa tay e fat hiện trên tay e gần chỗ mình hay test thuốc bị trầy xước ửng đỏ. Mà e ko piet có từ lúc nào .về nhà là hết. E ko tiếp xúc máu. Chỉ do huyết áp. Ai cũng nói ko sao. Mà e rất lo,13/07/2020,https://medlatec.vn/hoi-dap/hiv-c9-q53851#traloi
Cơ xương khớp,Gãy xương mác,E bị gãy 1/3 xương mác bị lệch mà bác sĩ nói không cần bó bột mà giờ đã 5 năm rồi mà khi vận động nhiều chổ gãy vẫn thấy đau ngồi lên ngồi xuống nhiều cũng thấy hơi đau không biết có ảnh hưởng gì về sau này không,12/07/2020,https://medlatec.vn/hoi-dap/gay-xuong-mac-c9-q53839#traloi
Cơ xương khớp,hoi vê độ mờ sau gáy,em đi siêu am o 12 tuân 6 ngay bác sũ noi la độ mờ sau gáy con em la 2.7 mm va dk goi la bât thường vây kêt quả đó có nguy cơ bị doaw cao ko ạ,12/07/2020,https://medlatec.vn/hoi-dap/hoi-ve-do-mo-sau-gay-c9-q53833#traloi
Cơ xương khớp,Chồi xương ở đầu dưới phía ngoài xương đùi phải,Mong bác sĩ tư vấn có phải mổ cắt ko,12/07/2020,https://medlatec.vn/hoi-dap/choi-xuong-o-dau-duoi-phia-ngoai-xuong-dui-phai--c9-q53828#traloi
Cơ xương khớp,Huyết học,"Chào bs! Bé nhà e bị ốm e cho bé đi khám kewts luận là viêm họng cấp. Nhưng trong giấy cét nghiệm e thấy bạch cầu tăng13000 , tiểu cầu tăng 554g/l , tăng cao vậy có sao không ạ",12/07/2020,https://medlatec.vn/hoi-dap/huyet-hoc-c9-q53821#traloi
Cơ xương khớp,Duphaston,"Thưa bác sĩ,ck kinh nguyệt e là 30 ngày, tháng này e bị chậm kinh 8-9 ngày, e đi khám nm tử cung 15.5mm, test hcg dưới 0.1mIU/ml, bs có kê cho e uống duphaston thì k biết e có thai k ạ.",12/07/2020,https://medlatec.vn/hoi-dap/duphaston-c9-q53819#traloi
Cơ xương khớp,Bệnh,"Em vô tình phát hiện ở dưới góc hàm có hạch ạ. Hạch nhỏ, không sưng, đụng vào di chuyển và có đau ạ. Em muốn hỏi là em bị bệnh gì ạ? Nên đi khám ở đâu và khám về vấn đề gì a?",12/07/2020,https://medlatec.vn/hoi-dap/benh-c9-q53804#traloi
Cơ xương khớp,Mặt bị lệch,"Thưa bác sĩ
Mặt em bị lệch sang bên trái nhưng ko phải do từ khi sinh ra mà bị . Em có thói quen ngủ một bên là bên trái
Còn có thói quen nhau một bên là bên phải
Em còn bị sâu một cái răng bên trái .
Em ko bt nguyên nhân từ đâu nữa
Mặt vẫn bình thường từ nhỏ cho đến lớp 7 thì bị thế ạ 
Mong bác sĩ cho em một lời tư vấn ạ",11/07/2020,https://medlatec.vn/hoi-dap/mat-bi-lech-c9-q53795#traloi
Cơ xương khớp,K,Con e mới 10 ngày tuổi mà lên nhiều nốt li ti màu trắng khắp đầu là bị sao ạ,07/07/2020,https://medlatec.vn/hoi-dap/k-c9-q53590#traloi
Cơ xương khớp,Hoang mang lo lắng,"Gửi bác sĩ
Tôi có bóc bánh có và sử dụng bao cao su. Tâm lí tôi hiện tại rất lo lắng về việc nhiễm hiv
Vậy tôi nên làm gì bây giờ vì tôi chưa đủ thời gian làm xét nghiệm?
Thêm nữa, tôi có thể sử dụng bộ test nhanh sau 14 ngày được không?
 
Chân thành cảm ơn",07/07/2020,https://medlatec.vn/hoi-dap/hoang-mang-lo-lang-c9-q53580#traloi
Cơ xương khớp,Hạch,Chào bác sĩ cháu có 2 cái hạch rất lâu rồi tầm 1-2 năm nay không đau và có to lên nhưng tốc độ tăng kích thích rất nhỏ. Vậy có sao không ạ cháu lo quá,07/07/2020,https://medlatec.vn/hoi-dap/hach--c9-q53578#traloi
Cơ xương khớp,Thiếu canxi,"Con e hơn 6m chậm tăng chiều cao có tháng tăng 1cm , bé bú k đủ sữa / ngày h có ăn dặm , nhg đợt này đêm bé trằn trọc , ngủ hay khóc ré mẹ phải bế vỗ mới ngủ lại . Nhg cứ như vậy cả đêm . Bs cho e hỏi như vậy cod phải con e thiếu canxi ?",06/07/2020,https://medlatec.vn/hoi-dap/thieu-canxi-c9-q53548#traloi
Cơ xương khớp,"Tay chân bị giật khi ngủ rất nhiều, k mơ k mớ","Bs cho e hỏi mẹ em năm nay khoảng 55,56t ạ
Mẹ e bị xương sống k biết có bị ảnh hưởng gì k ạ
Dạo này mẹ e ban đầu là giật ngực hay bị thức giấc, thời gian sau ngủ tay chân hay bị giật ( kiểu gân giật ấy ạ), e sợ để lau dài ảnh hưởng k ddi đứng được, bs giúp e với ạ k biết nguyên nhân tại sao, bây giờ muốn đi khám k biết khám ở khoa nào . E cảm ơn",05/07/2020,https://medlatec.vn/hoi-dap/tay-chan-bi-giat-khi-ngu-rat-nhieu-k-mo-k-mo-c9-q53523#traloi
Cơ xương khớp,mang thai,"em mang thai 32tuân tuổi hôm nay e đi siêu âm thì bác sĩ nói em bé bị giãn bể thận 2 bên nhẹ à 12mm(T) và 8,2mm(P) vậy bác sĩ cho e hỏi có nguy hiểm gì không ạ e đang cảm thấy rât lo lắng",05/07/2020,https://medlatec.vn/hoi-dap/mang-thai-c9-q53521#traloi
Cơ xương khớp,Hiv,Bs cho e hỏi trong khi qhtd lúc xuất e bị rách bao thì nguy cơ nhiễm là % ạ và sau bn ngày thì xn là chuẩn nhất,04/07/2020,https://medlatec.vn/hoi-dap/hiv-c9-q53486#traloi
Cơ xương khớp,Đứt tay,E bị đức ngón tay áp út và ngón út mai mỗi ngón 2mui bác sĩ bảo là e bị đứt gân máu sau 1tuan cắt chỉ hiện tại e cắt chỉ dc 4ngay nhưng e co 2ngon tay của e co k sát xuống dc cho e hỏi như thế ephai3 làm gì.,04/07/2020,https://medlatec.vn/hoi-dap/dut-tay--c9-q53482#traloi
Cơ xương khớp,.,"Con thường bị khó thở vào buổi chiều, cảm thấy mệt ,thấy no mặc dù chưa ăn gì và buồn nôn thì bị gì ạ",04/07/2020,https://medlatec.vn/hoi-dap/-c9-q53471#traloi
Cơ xương khớp,Nhờ BS tư vấn,"Tôi bị viêm gan C mạn. Trước khi điều trị tôi xét nghiệm có kết quả: xơ gan f4; tải lượng virus là:5,88 ×10^6.Tôi điều trị 12 tuần.
 Ba tháng  sau khi kết thúc điều trị tôi đã đi xét nghiệm lại và kết quả: xơ gan F0-1; tải lượng đếm virus: Không phát hiện được.
Vậy cho tôi hỏi với kết quả đó có thể coi là khỏi hẳn chưa? Tôi có thể hiến máu được không ạ?",04/07/2020,https://medlatec.vn/hoi-dap/nho-bs-tu-van-c9-q53470#traloi
Cơ xương khớp,Gãy xương đòn,"Chào bác sĩ trước đây em có bi tai nạn bị gãy xương đòn và em cũng đã phẫu thuật bắt đinh nối xương đòn lại và cũng đã hồi phục lại được kha khá lâu vài năm rồi ạ nhưng mà em vẫn chưa phẫu thuật lấy đinh nẹp xương đòn ra ạ em để vậy cũng vài năm rồi và cũng không có ảnh hưởng gì mấy hết chỉ có cái là đinh đóng trong xương dài chĩa thịt nhô lên thôi nhưng mà cũng vài năm rồi cũng không có sao cả,và rồi tự nhiên bây giờ ngay chỗ cây đinh ở trong chĩa ra nhô thịt lên bị bầm đen lên ngay chỗ cây đinh chĩa lên em không biết bị như vậy có vấn đề gì và em cần làm gì tốt nhất ạ xin bác sĩ tư vấn giúp em ạ em xin cảm ơn",04/07/2020,https://medlatec.vn/hoi-dap/gay-xuong-don--c9-q53466#traloi
Cơ xương khớp,Mang thai,Chào bác sĩ.Tôi mang thai 13w4d mà bsi nói độ mờ da gáy của bé 2.8-2.9 liêu nguy cơ dow có cao không thưa bác sĩ,04/07/2020,https://medlatec.vn/hoi-dap/mang-thai-c9-q53449#traloi
Cơ xương khớp,Hỏi,Chào bsi. Bé nhà em được 9th tuổi. Để ý thì bé bị lệch xương sườn. Bên trái trùng hơn bên phải chắc do nằm bên trái quá nhiều. Thì cho em hỏi giờ phải làm cách nào và có ảnh hưởng đến mai sau không ạ,04/07/2020,https://medlatec.vn/hoi-dap/hoi-c9-q53444#traloi
Cơ xương khớp,viêm họng hạt + lưỡi,"thưa bác sĩ em bị viêm amidan sau đó 1 tuần thì khỏi 
tuy nhien sau khi hết viêm amidan thì đáy lưỡi và vòm họng nổi viêm như viêm họng hạt nhưng không đau ăn ,uống bình thường,ko ảnh hưởng đến cơ thể lưỡi có màng trắng hơi hôi thì có sao k ạ",03/07/2020,https://medlatec.vn/hoi-dap/viem-hong-hat--luoi-c9-q53441#traloi
Cơ xương khớp,Về họng,Chào bác sĩ .em bị đau họng lâu rồi .và đang có em bé đc 3 tháng .dạo gần đây em phát hiện bị u như ở lưỡi gà em đi xét nghiệm lành tính .nhưng máy hôm nay em phát hiện ở dưới lưỡi có các hạt tròn nhỏ màu trắng ở dưới lưỡi .em hay ngâm gừng để chữa ho do em ko uống đc thuốc .ko biết các nốt đấy có phải do nhiệt hay bị sao ạ,03/07/2020,https://medlatec.vn/hoi-dap/ve-hong--c9-q53429#traloi
Cơ xương khớp,Hỏi về kết quả xét nghiệm mau,"Xin hỏi BS :
Tôi đi khám , làm xét nghiệm máu tất cả các chỉ số đều bình thường duy có MCV lúc nào cũng 77 và MCH thường từ 26,3 - 24,8 xét nghiệm điện đi kết luận Tân máu bẩm sinh nhưng không chỉ định điều trị : là sao ?
Tôi phải làm gì để đảm bảo sức khỏe ?
Xin cảm ơn BS !",01/07/2020,https://medlatec.vn/hoi-dap/hoi-ve-ket-qua-xet-nghiem-mau-c9-q53308#traloi
